"filename","title","description","feature","topic","role","level"
"./metadata.md","","","","","",""
"./help/user-guide/TOC.md","","","Release Information","","Leader, Architect, Developer, Data Architect, Data Engineer, Administrator, Business Practitioner",""
"help/user-guide/home.md","AEM 6.5 User Guide Hub","An overview of all of the essential resources for understanding, installing, managing, and using AEM 6.5","","","",""
"help/user-guide/capabilities.md","AEM 6.5 Capabilities User Guide","An overview of the essential capabilities of AEM 6.5","","","",""
"help/user-guide/implementation.md","AEM 6.5 Implementation User Guide","An overview of how to implement AEM 6.5","","","",""
"help/user-guide/resources.md","AEM 6.5 Additional Resources","AEM 6.5 release notes, certifications, and additional resources","","","",""
"help/user-guide/new.md","Resources for New AEM Users","Questions, answers, and resources for users new to AEM","","","",""
"help/user-guide/learn.md","Learn About AEM 6.5 Capabilities","An description of the essential capabilities of AEM 6.5","","","",""
"help/user-guide/best-practice.md","AEM 6.5 Best Practices","Resources for best practices, troubleshooting and training for AEM 6.5","","","",""
"help/user-guide/community.md","The AEM Community","The AEM Community","","","",""
"help/user-guide/troubleshooting.md","Troubleshooting AEM","Troubleshooting AEM","","","",""
