filename,title,description,feature,topic,role,level
help/assets/brand-portal-publish-assets.md,Publish assets to Brand Portal,Learn how to publish and unpublish assets to Brand Portal.,Brand Portal,,Business Practitioner,
help/assets/brand-portal-publish-folder.md,Publish folders to Brand Portal,Learn how to publish and unpublish folders to Brand Portal.,Brand Portal,,Business Practitioner,
help/assets/brand-portal-publish-collection.md,Publish collections to Brand Portal,Learn how to publish and unpublish collections to Brand Portal.,Brand Portal,,Business Practitioner,
help/assets/content-fragments/content-fragments.md,Working with Content Fragments,"Learn how Content Fragments allow you to design, create, curate and use page-independent content.",,,,
help/assets/content-fragments/content-fragments-managing.md,Managing Content Fragments,"Content Fragments are stored as Assets, so are primarily managed from the Assets console.",,,,
help/assets/content-fragments/content-fragments-models.md,Content Fragment Models,Content Fragment Models are used to create content fragments with structured content.,,,,
help/assets/content-fragments/content-fragments-variations.md,Variations - Authoring Fragment Content,"Variations allow you to author content for the fragment, then create variations of that content according to purpose (if required).",,,,
help/assets/content-fragments/content-fragments-assoc-content.md,Associated Content,Associated content provides the connection so that assets can be (optionally) used with the fragment when it is added to a content page.,,,,
help/assets/content-fragments/content-fragments-metadata.md,Metadata - Fragment Properties,You can view and edit the metadata (properties) for content fragments.,,,,
help/assets/content-fragments/content-fragments-delete.md,Content Fragments - Delete Considerations,Content Fragments - Delete Considerations,,,,
help/assets/content-fragments/content-fragments-markdown.md,Markdown,"When you are authoring, the content fragment editor uses markdown syntax to allow you to easily write content.",,,,
help/assets/creating-translation-projects-for-content-fragments.md,Creating Translation Projects for Content Fragments,Learn how to translate content fragments.,,,,
help/assets/manage-assets.md,Manage your digital assets,"Learn the asset management tasks like upload, download, edit, search, delete, annotate, and version your digital assets.","Asset Management,Search",,Business Practitioner,
help/assets/manage-collections.md,Manage digital assets collections,"Learn tasks to manage Collections of assets, such as create, view, delete, edit, and download collections.","Collections,Asset Management",,Business Practitioner,
help/assets/duplicate-detection.md,Enable detection of duplicate assets,Learn how to enable the detection of duplicate assets in Experience Manager.,"Asset Management,Asset Reports",,"Business Practitioner, Administrator",
help/assets/organize-assets.md,Organize your digital assets,"Organize your digital assets, images, files, folders, and so on using Experience Manager.","Asset Management,Search",,Business Practitioner,
help/assets/managing-video-assets.md,Manage video assets,"Upload, preview, annotate, and publish video assets in [!DNL Adobe Experience Manager].",Asset Management,,Business Practitioner,
help/assets/translation-projects.md,Create translation projects,Learn how to create translation projects in [!DNL Adobe Experience Manager].,Translation,,"Architect, Administrator",
help/assets/preparing-assets-for-translation.md,Prepare assets for translation,Create language root folders to prepare assets for translation to support multilingual assets.,Projects,,"Business Practitioner, Administrator",
help/assets/download-assets-from-aem.md,Download assets,Learn how to download assets from [!DNL Adobe Experience Manager] and enable or disable the download functionality.,"Asset Management,Asset Distribution",,Business Practitioner,
help/assets/light-box.md,Lightbox as your personal image gallery,Learn about Lightbox as your personal image gallery in Adobe Experience Manager Assets].,"Developer Tools,Renditions",,"Business Practitioner, Administrator",
help/assets/asset-insights.md,Asset Insights," Learn how the Asset Insights feature lets you track user ratings and usage statistics of images that are used in third-party websites, marketing campaigns, and Adobe's creative solutions.","Asset Insights,Asset Reports",,"Business Practitioner, Administrator",
help/assets/use-dtm-for-asset-insights.md,Enable Asset Insights through DTM,Learn how to use Adobe Dynamic Tag Management (DTM) to enable Asset Insights.,"Asset Insights,Asset Reports",,"Business Practitioner, Administrator",
help/assets/configure-asset-insights.md,Configure Asset Insights to get analytics.,Configure Asset Insights in [!DNL Adobe Experience Manager Assets].,"Asset Insights,Asset Reports",,"Architect, Administrator",
help/assets/check-out-and-submit-assets.md,Check in and check out assets for editing,Learn how to check out assets for editing and check them back in after the changes are complete.,Asset Management,,Business Practitioner,
help/assets/transition-cloud-services.md,Apply translation cloud services to folders,Apply translation cloud services to folders,Translation,,Administrator,
help/assets/use-page-tracker.md,Use Page Tracker and embed code in web pages,Lear how to include Page Tracker and embed JavaScript codes in your website code to enable Adobe Analytics to capture usage data around assets.,Asset Reports,,"Architect, Administrator",
help/assets/managing-linked-subassets.md,Manage compound assets with references and multiple pages,"Learn how to create references to digital assets from within [!DNL Adobe InDesign], [!DNL Adobe Illustrator], and [!DNL Adobe Photoshop]. Use the Page Viewer feature to view individual subasset pages of multi-page files such as PDF, INDD, PPT, PPTX, and AI files.",Asset Management,,"Business Practitioner, Administrator",
help/assets/related-assets.md,Related assets,Learn how to relate digital assets that share some common attributes. Also create source-derived relationships between digital assets.,"Collaboration,Asset Management",,Business Practitioner,
help/assets/private-folder.md,Private folders to share assets,Learn how to create a private folder in the [!DNL Adobe Experience Manager Assets] and share it with other users and the assign various privileges to them.,Collaboration,,Business Practitioner,
help/assets/video-renditions.md,Video renditions,Video renditions,,,,
